{
  "profile_ref": "secure-ref:SYNTHETIC_PLACEHOLDER",
  "profile_version": "1",
  "candidate_display_name": "Synthetic Candidate",
  "target_functions": ["analysis", "data analyst"],
  "target_industries": ["analytics"],
  "target_levels": ["entry"],
  "locations": ["remote"],
  "remote_preference": "remote",
  "minimum_salary": 0,
  "work_authorization": "CONFIRMED",
  "skills": ["python", "sql", "structured analysis", "document assumptions and quality checks"],
  "languages": ["english"],
  "certifications": [],
  "education": "Bachelor's degree",
  "years_experience": 3
}
